{
  "$schema": "https://json-schema.org/draft/2020-12/schema",
  "type": "object",
  "properties": {
    "$schema": {
      "type": "string"
    },
    "version": {
      "type": "number",
      "const": 1
    },
    "generatedWith": {
      "type": "string",
      "minLength": 1
    },
    "stack": {
      "type": "string",
      "enum": [
        "next",
        "vite-react",
        "astro",
        "react-generic",
        "unknown"
      ]
    },
    "profile": {
      "type": "string",
      "enum": [
        "static-content-site",
        "server-app",
        "spa"
      ]
    },
    "agents": {
      "default": [],
      "type": "array",
      "items": {
        "type": "string",
        "enum": [
          "claude-code",
          "codex",
          "cursor"
        ]
      }
    },
    "hookAgents": {
      "type": "array",
      "items": {
        "type": "string",
        "enum": [
          "claude-code",
          "codex",
          "cursor"
        ]
      }
    },
    "skillLayout": {
      "type": "string",
      "enum": [
        "mirrored",
        "single-agent"
      ]
    },
    "plugins": {
      "type": "array",
      "items": {
        "type": "string"
      }
    },
    "features": {
      "default": {
        "guidelines": true,
        "skills": true,
        "mcp": true,
        "architecture": true,
        "hooks": false
      },
      "type": "object",
      "properties": {
        "guidelines": {
          "default": true,
          "type": "boolean"
        },
        "skills": {
          "default": true,
          "type": "boolean"
        },
        "mcp": {
          "default": true,
          "type": "boolean"
        },
        "architecture": {
          "default": true,
          "type": "boolean"
        },
        "hooks": {
          "default": false,
          "type": "boolean"
        }
      },
      "required": [
        "guidelines",
        "skills",
        "mcp",
        "architecture",
        "hooks"
      ],
      "additionalProperties": false
    },
    "architectures": {
      "default": [],
      "type": "array",
      "items": {
        "anyOf": [
          {
            "type": "string",
            "enum": [
              "feature-modules",
              "server-first-components",
              "data-access-layer",
              "typed-contracts",
              "state-management",
              "custom-hooks",
              "component-composition",
              "styling-tailwind",
              "testing-strategy",
              "error-loading-boundaries",
              "secure-by-default",
              "modern-typescript",
              "ui-states",
              "islands-architecture",
              "rendering-strategy",
              "content-modeling",
              "request-boundaries",
              "multi-framework-boundaries"
            ]
          },
          {
            "type": "string"
          },
          {
            "type": "object",
            "properties": {
              "name": {
                "type": "string",
                "const": "feature-modules"
              },
              "boundary": {
                "default": "public-api",
                "type": "string",
                "enum": [
                  "public-api",
                  "forbid"
                ]
              }
            },
            "required": [
              "name",
              "boundary"
            ],
            "additionalProperties": false
          },
          {
            "type": "object",
            "properties": {
              "name": {
                "type": "string",
                "const": "rendering-strategy"
              },
              "variant": {
                "type": "string",
                "enum": [
                  "static-first",
                  "server-first",
                  "mixed"
                ]
              }
            },
            "required": [
              "name"
            ],
            "additionalProperties": false
          },
          {
            "type": "object",
            "properties": {
              "name": {
                "type": "string",
                "enum": [
                  "server-first-components",
                  "data-access-layer",
                  "typed-contracts",
                  "state-management",
                  "custom-hooks",
                  "component-composition",
                  "styling-tailwind",
                  "testing-strategy",
                  "error-loading-boundaries",
                  "secure-by-default",
                  "modern-typescript",
                  "ui-states",
                  "islands-architecture",
                  "content-modeling",
                  "request-boundaries",
                  "multi-framework-boundaries"
                ]
              }
            },
            "required": [
              "name"
            ],
            "additionalProperties": false
          },
          {
            "type": "object",
            "properties": {
              "name": {
                "type": "string"
              },
              "variant": {
                "type": "string"
              }
            },
            "required": [
              "name"
            ],
            "additionalProperties": false
          }
        ]
      }
    },
    "audit": {
      "default": {
        "exclude": [],
        "rules": {},
        "ruleOptions": {}
      },
      "type": "object",
      "properties": {
        "exclude": {
          "default": [],
          "type": "array",
          "items": {
            "type": "string"
          }
        },
        "rules": {
          "default": {},
          "type": "object",
          "propertyNames": {
            "type": "string",
            "enum": [
              "NB-ARCH-001",
              "NB-ARCH-002",
              "NB-ARCH-003",
              "NB-ARCH-004",
              "NB-ARCH-005",
              "NB-ARCH-006",
              "NB-ARCH-007",
              "NB-ARCH-008",
              "NB-ARCH-009",
              "NB-ARCH-010",
              "NB-ARCH-011",
              "NB-ARCH-012",
              "NB-ARCH-013",
              "NB-ARCH-014",
              "NB-ARCH-015",
              "NB-PROFILE-001",
              "NB-PROFILE-002",
              "NB-ASTRO-001",
              "NB-ASTRO-002",
              "NB-ASTRO-003",
              "NB-ASTRO-004",
              "NB-ASTRO-005"
            ]
          },
          "additionalProperties": {
            "type": "string",
            "enum": [
              "off",
              "warn",
              "err"
            ]
          }
        },
        "ruleOptions": {
          "default": {},
          "type": "object",
          "additionalProperties": false,
          "properties": {
            "NB-ARCH-001": {
              "type": "object",
              "properties": {
                "featuresDir": {
                  "type": "string",
                  "minLength": 1
                }
              },
              "additionalProperties": false
            },
            "NB-ARCH-002": {
              "type": "object",
              "properties": {
                "featuresDir": {
                  "type": "string",
                  "minLength": 1
                }
              },
              "additionalProperties": false
            },
            "NB-ARCH-003": {
              "type": "object",
              "properties": {},
              "additionalProperties": false
            },
            "NB-ARCH-004": {
              "type": "object",
              "properties": {},
              "additionalProperties": false
            },
            "NB-ARCH-005": {
              "type": "object",
              "properties": {
                "dataLayerGlobs": {
                  "type": "array",
                  "items": {
                    "type": "string",
                    "minLength": 1
                  }
                }
              },
              "additionalProperties": false
            },
            "NB-ARCH-006": {
              "type": "object",
              "properties": {
                "dataLayerGlobs": {
                  "type": "array",
                  "items": {
                    "type": "string",
                    "minLength": 1
                  }
                }
              },
              "additionalProperties": false
            },
            "NB-ARCH-007": {
              "type": "object",
              "properties": {
                "dataLayerGlobs": {
                  "type": "array",
                  "items": {
                    "type": "string",
                    "minLength": 1
                  }
                }
              },
              "additionalProperties": false
            },
            "NB-ARCH-008": {
              "type": "object",
              "properties": {
                "envFiles": {
                  "type": "array",
                  "items": {
                    "type": "string",
                    "minLength": 1
                  }
                }
              },
              "additionalProperties": false
            },
            "NB-ARCH-009": {
              "type": "object",
              "properties": {
                "dataLayerGlobs": {
                  "type": "array",
                  "items": {
                    "type": "string",
                    "minLength": 1
                  }
                }
              },
              "additionalProperties": false
            },
            "NB-ARCH-010": {
              "type": "object",
              "properties": {},
              "additionalProperties": false
            },
            "NB-ARCH-011": {
              "type": "object",
              "properties": {
                "sanitizers": {
                  "type": "array",
                  "items": {
                    "type": "string",
                    "minLength": 1
                  }
                }
              },
              "additionalProperties": false
            },
            "NB-ARCH-012": {
              "type": "object",
              "properties": {},
              "additionalProperties": false
            },
            "NB-ARCH-013": {
              "type": "object",
              "properties": {},
              "additionalProperties": false
            },
            "NB-ARCH-014": {
              "type": "object",
              "properties": {},
              "additionalProperties": false
            },
            "NB-ARCH-015": {
              "type": "object",
              "properties": {},
              "additionalProperties": false
            },
            "NB-PROFILE-001": {
              "type": "object",
              "properties": {},
              "additionalProperties": false
            },
            "NB-PROFILE-002": {
              "type": "object",
              "properties": {},
              "additionalProperties": false
            },
            "NB-ASTRO-001": {
              "type": "object",
              "properties": {},
              "additionalProperties": false
            },
            "NB-ASTRO-002": {
              "type": "object",
              "properties": {},
              "additionalProperties": false
            },
            "NB-ASTRO-003": {
              "type": "object",
              "properties": {},
              "additionalProperties": false
            },
            "NB-ASTRO-004": {
              "type": "object",
              "properties": {},
              "additionalProperties": false
            },
            "NB-ASTRO-005": {
              "type": "object",
              "properties": {},
              "additionalProperties": false
            }
          }
        }
      },
      "required": [
        "exclude",
        "rules",
        "ruleOptions"
      ],
      "additionalProperties": false
    }
  },
  "required": [
    "version",
    "generatedWith",
    "stack",
    "agents",
    "features",
    "architectures",
    "audit"
  ],
  "additionalProperties": false,
  "$id": "https://node-boost.dev/schema.json",
  "title": "node-boost configuration"
}
